1,"The cast of characters includes some of the coolest, funniest, and most tragic in film, and the actors who play them fit seamlessly into this new universe. Alec Guiness is flawless as Obi-Wan Kenobi, a Jedi on the run from the evil Empire. Harrison Ford is awesome as Han Solo, a smuggler and thief who helps the gang rescue the princess. But the my favorite character of all time is Darth Vader. Not only is he the coolest bad guy, but we learn in later films why he is evil and start to feel sympathetic for him. Not to mention that badass booming voice that can make ordering a pizza sound threatening."
1,"Roberto Benigni's Vita e bella, is in many ways similar to Chaplin's Great Dictator. Both are comic attacks on fascism, but the former's is the more successful. Benigni initially accesses the emotions of his audience through simple comedy, which is a pleasant mix of Keaton and Chaplin. Romance ensues with his real life wife Nicoletta Braschi. The first half of this film has been seen by various critics as being inferior to the second, but this is certainly not the case. In the first section we follow the delightful romance that will eventually lead to marriage and the creation of the wonderful Giosue"
1,"Casablanca is a film about the personal tragedy of occupation and war. It speaks to the oppression of the one side - and the heroism and self-deprecation of the other. From opportunists, to isolationists - from patriots to disenchanted lovers - the film has everything a man or woman would enjoy. Bravery, courage, intrigue, romance, beauty and love. Leading actors to please any appetite. Watching this film is to step back to a world that doesn't exist - yet to know it. It is to experience lives that have never been lived - but are ""real to you."" It is to know pain and joy, pride and pity for characters that are a fiction - yet are so real that you can't help but get lost in their story."
1,"It is a testament to Chaplin's filmmaking skills that he is able to impose such significant meaning on what really boils down to little more than a series of comedy skits strung together on an apparently flimsy clothesline of a plot. Indeed, the cinematic value of Modern Times is unquestionable, but it is ironically noteworthy that such a simple and even blocky plot is made into such a memorable film experience and delivers such a strong, time-transcending message about poverty stricken populations."
1,"The Silence of the Lambs, having accomplished the rare feat of winning all five of the major Academy Award categories, is a remarkable achievement in filmmaking. Gruesome, pulpish material was transformed by dedicated participants on all levels of production, and a film that would have failed in the hands of many others wound up becoming a modern masterpiece. Taut direction and a superb screenplay might be the best arguments for the film's power, but the flashiest are certainly delivered in the bravura performances of Hopkins and Foster. Their interplay -- and remember, they only share a handful of scenes together -- is nothing short of riveting."
1,"a very emotional , and , for many , a very disturbing movie , the deer hunter is a truly magnificent movie that should not be missed . 
the greatest performances possible are turned in by all actors , and cimino's directing , which is considered to be at his all-time best in this film , is equally dazzling . 
do not miss this film , it will captivate and astound you . "
1,"This is truly one of the best Disney movies ever. I really enjoyed it when I first seen it, about when I was 6, and since then I watched it over and over again. I simply LOOOOVED the music. It's one of the best soundtracks I've ever heard. And, speaking of soundtrack, I just can't tell in words how much I love the song ""Can You Feel The Love Tonight"". Is one of my favorite songs ever. I truly believe that this motion picture could easily be nominated for The Best Picture, but The Best Song and the Best Original Score is really enough. I wonder if they will ever think to make a prequel of this movie in order to understand who is Mufasa, Scar, Sarabi and the other characters. In short, this movie will be remembered in the next 100 years. Truly."
1,"It's amazing that this is over 20 years old - apart from the actors looking so young, the film doesn't feel dated at all. The sci-fi visions here are still bleak and futuristic as they were then - this is not the Star Trek vision of the future. The foreboding exists long before John Hurt spills his secret, Scott's direction is excellent throughout. Once the alien is ""born"" the tension is cranked up and the characters dispatched one by one (a formula we know oh-so well now!)"
1,"And it is within this film's subtle touches of the canvas, the clackity-clacks of the young boy's big wheel riding along the empty hallways of the hotel, the labyrinthian garden representing the mind's fine line between sane and insane, Kubrick's purposely transfixed editing inconsistencies, continuity errors and set mis-arrangements, that we discover a world guided by the righteous and tangible, but coaxed away by the powerful and unknown. I have never read the book upon which the film is based, but without that as a comparison point, I am proud to say that this is one of the most terrifying films that I have ever seen."
1,"I have seen ALOT of movies in my life, but none have moved me the way Vertigo has...It's simply brilliant...the more times one views it, the more one picks up from it...a true masterpiece from the master himself...When I think Vertigo, I think the colors red and green...when I think Vertigo I think obsession with love, and the film itself...This movie is so deep that you could write a thesis on it and keep adding to it from time to time...Hitchcock really gave his all in this picture...it's about the ultimate love...wanting to achieve the ultimate love, and, as happens in life, never having love turn out to be the way we want it to be...all star performances by Stewart, Novak and Bel Geddes make this visually stunning masterpiece a true film classic...Newly restored, the DVD version simply blows you out of the water....I have seen the movie about 20 times now, and everytime I love it more...Vertigo is the ultimate cult film for me, as I keep going back to it more and more...considering it's dark storyline, it must be a glut for punishment, but Hitch only keeps me wanting more....10 stars...only because I can't give it 100 stars!"
1,"This film is a true masterpiece, expressing a profound statement about friendship and betrayal, with fantastic acting, writing, directing and music. There is a shortened, two-and-a-half-hour version of the film released that is a disaster. It is like trying to understand a jigsaw puzzle with half of the pieces missing. The original four-hour film can be viewed and enjoyed several times and each time the viewer will see something new."
1,"Beside proving himself as a brilliant director, Mel Gibson more importantly gave life to a historical hero whose superb gallantry, vivid character and magnificent spirit shall never be history. Along with the unforgettable 'Alba gu bragh!' and the unprecedentedly heart-stopping 'Freeeeedom', Braveheart unquestionably is one of the greatest movies ever made."
1,"The film is full of surprises in both plot and characters. I left the theatre feeling lighter. It is truly one of a kind, eccentric, unusual and uplifting. I will not say more on it as it would spoil the fun.
I gave it a 10 out of 10 for something so completely out of the ordinary and so very unhollywood."
1,"From the opening moments of ""Reservoir Dogs"" you sense that you are watching a different kind of crime drama. The style and dialog of this picture bestows a level of intelligence upon it's characters that defies the reality of their chosen profession. Having said that,this movie is absolutely riveting in it's movements from the ordinary, to the grim, to the horrific aspects of a career criminal. Quintin Tarantino has written a tale of an almost corporate order to constructing a crime gang. The delight is in meeting these characters one by one. The particular crime is no more crucial to the film than a 7-11 stick-up"
1,"Often hype about films lead to disappointment and after waiting 14 months after release for my local cinema to show this film, I was done thinking about it. Thank goodness too, rather than challenge my brain (not hard to do unfortunately) this film went straight for the heart, ripped it out and kicked it around the floor for 90 minutes. As the addictions plunged further into the depths of Hell, I felt myself more and more arrested by the film. I've never left a film shaking or feeling physically ill- not including Pearl Harbour, of course :) You want to look away, but cannot."
-1,"I created this account just to give this 1 star. That's how bad it was. I went into this expecting a generic Christmas movie, and I didn't even get that. The ""plot"" is awful. I put plot in quotation marks because I'm not even sure if this movie has one. Two guys walk out to a car and talk for an hour. That's all that happens. It's basically a feature length sermon, and a crappy one at that. There are literally NO redeeming qualities in this film. The camera work is extremely amateurish, and the acting and direction were absolutely abysmal. I had extremely low expectations for this, and it still managed to be disappointing.┬á"
-1,"This film was the worst film I have ever viewed. It was like a ""homework assignment"" for a film class. It totally misses the mark when it comes to the ""message"" it is TRYING to relay. Characters are over exaggerated, poor acting and as for a plot...well it is utterly ridiculous. The cover shot is what made me think it may be a decent film, the co-actor is handsome and that's about it. Moral of this movie: NEVER JUDGE A MOVIE BY IT'S COVER! Save your time, money and energy and make your own home movie and you will be far better off than I. It was painful to watch and quite frankly I am surprised that anyone would spend money to make and distribute it!"
-1,"I wanted to punch the TV. Watching it was torture. I hated it. Never watch this movie. The terrorists are annoying. Adam Sandler is annoying. I normally like him but not in this one. I wanted to break the DVD. This is the most irritating film in the world. The comedian he's jealous of is obnoxious. The only remotely funny part is the rocker with the black teeth getting all the girls. It was so irritating I wanted to punch the TV. DO NOT BUY THIS MOVIE UNLESS YOU WANT TO ANNOY SOMEONE. If you even like Adam Sandler a little bit, Don't buy it. It will just make you hate him. Do yourself a favor, if you see it in the store, hide it to put everyone out of danger of buying it. Its a waste of the $1.99 I paid for it."
-1,"This movie was so bad I couldn't sit through it without doing something else. There was no plot and no point. I was thoroughly bored and for a film about a stand up comedian, I couldn't recall one joke or funny line worthy of the description. Politicians with no charisma speaking technical jargon could not be less entertaining."
-1,"This is without a doubt one of the most idiotic films ever made. It's about cruise ship waiter Shecky (Sandler) wanting to be a comedian on the cruise ship. First off, there is not one funny or clever line in the entire movie honestly. It is so unfunny it's pathetic. There is surprisingly not much crude or sexual humor, but the f-word is plentiful. The budget is really low, and that also ruins the film. It takes place on a cruise ship, but it seems they only had money to rent out a small boat and only had money for 10 ship extras, one of which is Billy Bob Thornton. The opening credits are animated reeeeeaally cheaply, and it is just pathetic. I hate this movie and everyone else that sees this will hate it too."
-1,This movie is by far the worst movie ever made. If you have to create a film costarring the guy who plays Lars in heavyweights than don't make the damn film. I have to say that I could watch Leprechaun in Space 6 times before I could watch the trailer for this POS of a movie. Adam sandler should be restricted from any movie after this disgrace. Watching this movie is like a mix of listening to Cher and willingly putting your dick in a blender. Anyone with half of a brain cell will realize that this movie is
-1,"Well, It is a very rare night that I do not finish watching a movie that I set out to watch. This movie is so bad that I could not bring myself to watch all of it. No sane person or more importantly any movie watcher with any taste will even remotely find this movie either likable or watchable. I like many others think Adam Sandler is a great actor at times but inspiration for this movie must have come from deep down in a his bowels rather than his brain. Everything about this movie is bad, from the moment that the viewer sets eyes on it to the moment 30 minutes later that a person is pleading with another family member to put them out of their misery!! If you even think of getting this movie out do the world a favour and donate the cost of the rental to the red cross as you would be going the movie world a true injustice should you support this movie in any form what so ever, o how I wish I had been warned earlier."
-1,"Words cannot begin to express how awful this movie is. Have you ever seen Lawnmower Man? Remember those CGI scenes in which Jeff Fahey gets it on with the CHI woman? OK, now imagine someone watched that and thought ""hey, there's a kids' movie here!! I just have to find some way of slapping a script together, hiring the guys who made these really cool graphics in the early 90s and I'll make literally thousands of dollars!"""
-1,I had no idea when I started watching this movie what it was about but I was very well surprised by the extremely low quality of the movie.
-1,"I'm at a loss for words. This movie is beyond description. I don't believe there is a language on Earth that has a word that can describe how horrible this movie is. If you do attempt to watch it, be sure to stick around for the ""suprise ending"". I only made it about three quarters of the way through this piece of crap before I couldn't take it anymore. Fortunately(or unfortunately) a couple of my buddies stayed till the end. When they woke up from their coma and after a couple of weeks of therapy they were able to fill me in on what I had missed. This movie has no story, no plot, horrible writing, and even worse acting. If you enjoy watching train wrecks or auto accidents then this film is for you. I think my IQ dropped about 30 points from watching this (insert expletive here)."
-1,"Oh dear Gods, this is awful. Stay away, just stay away. If you think you've seen bad movies, think again. Never before has my brain hurt as much as it did after I watched this movie. The acting, if it is allowed to be called that, is enough to cause internal bleedings inside your head. The story is so thin it is just barely there... no wait, scratch that. There is not a complete story there, but once in a while, there is a few thin lines that stick up from all the amount of horribleness, and believe me, those few lines should have been shot. The best way to enjoy this movie is to drop napalm on it, and watch the cozy fire from a distance."
-1,"This movie, nothing more than a cheesy scenes needlessly thrown together, truly has no heart or point to it, and is among the worst that I have seen. It attempts to do everything without focusing its attempts. Just like the way that a person who tries to multitask only does a semi-good job on either task, this movie does no good job at anything. If the movie were sped up, it would seem like a parody of Hollywood films. I am honestly shocked that anyone enjoyed this film. Not only did the Oscars like it, they liked it more than ""The Shawshank Redemption"" and ""Pulp Fiction"", both among the best movies of all time,and both released in the same year."
-1,"I don't have a lot of reasons to give. All I can say is that every other Pixar movie I have rated a 10. I love animations, and the artwork for this one is top notch. Pixar has been terrific at delivering great stories until this one. I even love CARS, which many others found fault with. I wasn't in a bad mood when watching this one. I had great expectations. It's simply sucks. It's made a lot of money and has over an 8 rating, so I'm in the minority here. I want to caution someone like me to save their money so please read the other reviews with a 1 star rating. Maybe that will help guide you to a different movie to watch."
-1,"Well, didn't see that one coming. Expected it to be more like The Notebook, which I adore, but this is a really sad movie. There is a love story going on but with all the troubles and sorrows that lead characters bear it is a rather heavy life story. Wanted to see something romantic, nice, lovely - this ain't it. Wanted to see something to cheer me up but instead now I'm in the blue. Good acting, nice music, pretty scenery, too bad it's such a heartbreaking story. There's a time in one's life when one needs something to cry to, this is one those movies. If You want to cry Your tears out, this is the one for You. So no, this is not a romantic drama, this is a tragic story."
-1,"What can you really expect with a step up film? I mean, the dancing is great and all, but if you're not all into dancing in the first place, this movie definitely will make your eyes and ears bleed!! The choreography is the only reason I gave this garbage film a 2 out of 10 rating and not a full on 1. Every other aspect of the picture is poor and horribly executed, especially the writing, which I will discuss. The acting of course is something of a train-wreck because the so-called ""actors"" have no idea how to improvise and therefor they're just saying lines (very cheesy lines. pretty much what I meant when I said the writing was bad) which gets completely unrealistic REALLY fast."
-1,"Another attempt to put real British history and characters on the screen for US audiences, only it does not contain much history - it was a really exciting period politically with loads of REAL characters far more interesting than the Duchess of Devonshire - and is just a tired retelling of parallels with the Charles/Diana/Camilla menage-a-trois done out with a glossy video of the best of UK country houses. Keira Knightley, over-exposed, cannot live up to the demands of being centre stage but does her best. "
-1,"I like a good rom-com and this isn't one. Where do I start? Within the first 10 minutes I truly dislike perfect Elizabeth. Then there's the estate agent showing David the apartments, basically the movie is full of annoying characters which with all it's plot holes lack of chemistry between the two leads and the unnecessary sub plot of the downstairs neighbour makes this 91 minutes of pure garbage. As for the plot holes, so many so little time to list them all. However the most ludicrous part is how Elizabeth recovers so quickly from her coma and why doesn't Jack fill her in on David's part in it all."
-1,"I don't have a lot of reasons to give. All I can say is that every other Pixar movie I have rated a 10. I love animations, and the artwork for this one is top notch. Pixar has been terrific at delivering great stories until this one. I even love CARS, which many others found fault with. I wasn't in a bad mood when watching this one. I had great expectations. It's simply sucks. It's made a lot of money and has over an 8 rating, so I'm in the minority here. I want to caution someone like me to save their money so please read the other reviews with a 1 star rating. Maybe that will help guide you to a different movie to watch."
-1,"I gave this movie a 1 for the basic fact of it being empty and without substance. It is a film about a female who has a good job and is ""successful"" who goes out after given a promotion and has sex with a fat ass at a club which she regrets but ends up having to live and falls in ?love with a fat overweight pot head. The male character has no character what so ever and the female in the film is sooo washed its not even funny. A dope fiend gets a girl pregnant and we are supposed to feel that the girl in the film is more special than the guy. I don't think so happens everyday. This movie is about Nothing! Films like this are enjoyed by people who don't have a brain and laugh at a person passing gas. Give me break."
-1,"This is possibly one of the worst films I have ever had the misfortune to see, - story line was weak, actors bad - Is Hugh Grant ever differnt whatever role he plays? It was a vastly over rated hyped up effort which only made the headlines because it was felt that a cheap British effort had to make it sometime!! Don't bother with it - a good old repeat of Morse or Agatha Christie Poirot on TV is a better bet!"
-1,"What a terrible film! Why didn't they run? hide? escape in some other obscure way? No clue! There was no establishment of any construct that would explain this behavior. The characters were flimsy, empty, and unbelievable. They were free and angry; but still they would not run or hide. There was no establishment of anything in the film the simple terms that were used were barely even defined (i.e. carrier etc.) I would have quit watching the film but it seemed like it was going to get better all the way through and the only thing that really improved the film was not having to watch it any more as the credits rolled. There was nothing worth seeing in this film."
-1,"This movie is little more than cheesy student film. The acting, the writing and the directing are very amateurish. Many people have complained about the special effects and CGI. I was expecting that for a low budget movie such as this, so it didn't bother me. I watch low budget movies to see them rise above their limits but ""Star Quest"" failed miserably at that. It is filled with tired clichés and blatant ripoffs. Someone should check the directors backpack for a copy of ""Movie Directing for Dummies"". Of the many problems I think the cheesiest were the multiple flashbacks that were silent except for the melodramatic slow piano music."
-1,"After a snappy beginning, Amelie became unbearably boring. The title character was the principal problem. About two-thirds of the way through the movie, I lost all interest in what would happen to her. I wanted to scream out, ""Just say something. Anything."" The ending was ludicrously delayed. What did everyone else see in this movie?"
-1,"This film looked beautiful and pitting Jennifer Connelly to play a young Elizabeth McGovern is a brilliant piece of casting. But the rest of the film falls terribly short. The story is all over the place, the direction is utterly confusing, the script is laughable and, despite the great cast, the acting is pathetic at best. I've seen two versions of this film and it gets worse and worse every time. I'm not too sure how director Sergio Leone envisioned this film, but it felt like Leone lost his focus and tried to put two small overblown films into one hugely overblown film. How on earth this film got onto IMDb's top 250 is beyond me. I think Once Upon a Time in America may fall into the category of being ""voted"" a great film based on the names in the cast and production crew."
-1,"Whiplash wants to be about the love of great art, but is actually about the hate of great art. It has JK Simmons - a brilliant actor - playing a disgraceful character, stitched together from completely unrealistic, inconsistent motivations and actions, only conceived to bludgeon the viewer into thinking we're watching something profound. It casually tosses in assault, depression and suicide in a way that only a clueless, opportunistic director could. It has a big finale that would be powerful if only it made some sense for the main characters involved - it doesn't."
-1,"This movie is one big yawn after another. It concerns an illicit love affair and a lot of sitting around doing nothing for two hours. Humphrey Bogart wears a mac and smokes while various characters mooch around trying to look war torn. I fell asleep several times during watching this cheese fest and was told I never missed a thing ( except for a few characters smoking cigarettes). Also, the ending is very contrived as Bogart is dragged to the electric chair screaming and begging. The only interesting moment is the airport departure where Bogart is hanging on to the wing of the plane as it takes off shouting:"" Here's looking at you, kid!"" through the window in a vain attempt to stop her leaving. The only truly enjoyable scene in the movie."
-1,"overall , the film doesn't stick because it doesn't entertain , it's confusing , it rarely excites and it feels pretty redundant for most of its runtime , despite a pretty cool ending and explanation to all of the craziness that came before it . 
oh , and by the way , this is not a horror or teen slasher flick . . . it's 
just packaged to look that way because someone is apparently assuming that the genre is still hot with the kids . 
it also wrapped production two years ago and has been sitting on the shelves ever since . "
-1,"unfortunately , even he's not enough to save this convoluted mess , as all the characters don't do much apart from occupying screen time . 
with the young cast , cool clothes , nice hair , and hip soundtrack , it appears that the film is geared towards the teenage mindset . 
despite an american 'r' rating ( which the content does not justify ) , the film is way too juvenile for the older mindset . 
information on the characters is literally spoon-fed to the audience ( would it be that hard to show us instead of telling us ? ) , dialogue is poorly written , and the plot is extremely predictable . "
