1,"This movie is strong, good script, great casting, excellent acting, and over the top directing. It is hard to fine a movie done this well, it is 29 years old and has aged well. Even if the viewer does not like mafia type of movies, he or she will watch the entire film, the audiences is glued to what will happen next as the film progresses. Its about, family, loyalty, greed, relationships, and real life. This is a great mix, and the artistic style make the film memorable."
1,"One of my all time favorite movies. Jack Nicholson has the part down perfect and the supporting cast of ""nuts"" seem to make it all come together perfectly. A low budget film that made millions. The film was set in the 60;s and filmed at the Montana State Hospital in Galen, Montana. The ""Chief"" in the movie is a good side kick of reality for Jacks character. The reality is also that of what happens to people once put into a insane asylum. Crazy or not. Many times the movie brings you to think, ""what if it was me""? I watch very few movies twice. This is a picture that you can do that ! The ""Ringleader"" Mr. McMurphy takes charge of movie from the beginning."
1,"After seeing The Godfather and improving it as one of my favorite films, I wanted to get more into The Godfather so I rented this. Words can't describe how great this sequel was. The acting once again was amazing and the story and how the movie went on just never got me bored. Everything in this movie was clearly beautiful. The ending by far was my favorite when there all sitting at the table talking. There were so many great scenes like Vito when he was younger, Fredo at the lake, and many many more. You have to see this movie because it's just brilliant filmaking. It's not better than it's first film but still an extremely worth sequel."
1,"This movie it's one of the greatest work from this director. From the start, it takes you to the very end of the movie. The performance of the actors are truly genius. The characters are emblematic. The movie takes you through a journey full of violence, drugs and blood. One of the big pros of this movie, its the fact that its divided on segments. Each of this segments, takes you to a different part of the sequence. And it's amazing how every single piece fits at the end of the movie. The script is genius. Also it's great to see Tarantino on screen. There's a lot of directors that tends to appear on their movie. The cast it's wonderful, couldn't be more perfect than this. You will be scared, you will laugh, you will dance, you will cry but mostly, you will be on suspense during the whole time. There's a lot of scenes that are very risky, talking about the photography and direction of the movie, but the story really fits. Genius movie."
1,"Such films like this should be enshrined in museums, simply due to the fact it destroyed the entire genre of mystery films. While this film was unique and captivating, no other mystery will ever accomplish this sort of cult status, single handedly shaping a genre. While most mysteries try to shock you too often with twists and even more twists, it turns out to be overkill. This film encompassed such ideas with flair and originality, which is probably the reason Brian Singer is sticking to sci-fi action films. Only Memento and The Game are the only recent mystery movies worthy enough to stand beside this film. Sadly, Singer has somewhat sold out by doing the X-Men movies, but I guess trying to make films like this would be too taxing. This film will always bring a smile to my face when I watch it with someone who hasn't seen this movie. A good viewing every time I watch it, the new special edition DVD is awesome."
1,"Leone's beautiful vision met with an epic story to create one of the most beautiful movies of all time. Four hours long but time melts away as you are transported into New York. In a movie where the importance of time is stressed, and how it should not be wasted, it is pleasing that this considerably long movie does not waste, rather enhance your time. Instead of regretting lost time we are instead left exhilarated and wondering. Performances all-round are fantastic right from the child performances, 'Noodles, I slipped' to the aged De Niro with a look in his eye that he has seen it all before. His weariness is astonishingly realistic and applause should be directed at De Niro and his method. A true masterpiece."
1,"Aamir does it again. what a movie .from start to the end, hilarious moments.screenplay is fantastic. full on comedy and yet it never looses its heart. Aamir pulls off a 22 year old character with brilliance. never for once you feel you are watching aamir .It was rancho on screen. sharman n madhavan - i bow down to them. music looks OK on cd but during movie it worked as a plus point. situational tracks works in the favour of film. runtime may sound a bit too much but believe me, you wont know when the first half is over. second half may seem a bit too hilarious but apart from that its a masterpiece. gr8 aamir ,another brilliant movie."
1,"It's simply ridiculous how underrated this movie is. It is one of the funniest movies I have ever seen. It never lags, it never slows down, it is a movie that has a wonderful flow to the plot. That along with the brilliant writing makes this an awesome movie. Aamir and Salman are outrageous, even Raveena and Karishma are funny in this movie. Paresh Rawal and Shakti deliver some great bad guy comedy, but Viju Khote and the Ajit-wannabe are the best with their dumbfounded bad-guy intentions. If you want to laugh, and enjoy a movie, watch this movie, do it with family or friends, you will not regret it. Most indian movies tire me out by the end, cause they are 3 hours long. This movie is just as long, but I wish there was more when it ends, cause it's an amazing flick."
1,"This is a movie that keeps you locked to the screen,because it has everything a great movie should have. A great story,a good length,tension,it is a WW2 movie and the actors give top performances.Not just Steve McQueen,although his performance is brilliant,but also James Garner,James Coburn,Richard Attenborough,Charles Bronson and in this film,one of the greatest roles Donald Pleasance,playing the forger. It isn't historically accurate,please read the book by Paul Brickhill,but that doesn't matter a bit. This film gives you an image of POW camp,the prisoners and their guards,the Germans are also played brilliantly by German actors. I will not repeat the story here,but I can tell you,this film will capture you,all the characters are portrayed brilliantly by the actors. There is excitement,humor,tension,drama and emotion. See it,you will not regret it."
1,"I was really disappointed when i saw that this film only had an average rating of 8 stars, it is my favourite film of all time, the greatest action film ever created, and i never tire of watching it Its quality stuff, from start to finish, no cheesy moment, which is what you need in a film, Bruce Willis went on to have a cheesefest in Armageddon, but he will never better his performance in this film ever again. It isn't just Bruce, its Alan Rickman as well who is fantastic, putting on a great German accent to be a ruthless, smart criminal, the film is everything, and to all of you who gave it a low rating, please watch it again and realize the beauty."
1,"The science fiction survival genre has become a big hit recently with 2013's 'Gravity' and last years 'Interstellar', and now the Mars-set tale 'The Martian'. From the hands of sci-fi connoisseur Ridley Scott, the mastermind behind 'Alien' and 'Blade Runner' comes the thrilling screen adaptation of Andy Weir's novel. Within the first few minutes, the audience are already on the edge of their seats as Matt Damon fights for survival in an Oscar-worthy performance. Playing an astronaut abandoned on the desolate surface of Mars after being presumed dead, Damon must do all he can to endure the martian environment, supported by some stunning cinematography and fantastic visual effects, 'The Martian' is able to blend humour and emotion within it's dramatic plot of survival. Jessica Chastain, Jeff Daniels, Kate Mara, Sean Bean, Chiwetel Ejiofor, just a few big names that support Damon wonderfully. If you are a fan of 'Interstellar' or any other science fiction survival tale or even some of Scott's previous sci-fi adventures, then this is one to definitely add to your watch list. Best viewed on the big screen!"
1,"The movie starts as a normal murder mystery and somewhere 15-20 minutes in the movie you'd be like what makes it deserve all that appreciation? But wait, it hasn't even started yet. It isn't all what it seems like and one surely can't judge the book by its cover in this case. The movie is fully of surprises and at the end of it you'd be all smiles that's all i can say!"
1,"The rivalry between Hunt and Lauder is just played brilliantly... The race sequences are superb, really taking you back to the 70s... The heyday of this awesome sport. It shows the end of an era where the gentlemen drivers begin to give way to professional sportsmen and the end (in my opinion) of the excitement of the sport. It shows what a pale reflection today's F1 is of this once great sport, and what great characters we have lost..."
1,"THE sci-fi movie. It's nearly perfect in every way: storyline, characters, menacing threat, suspense, action, direction, music, emotion, etc... It's always been a favorite of mine and still is. To me this is not just a film, it is an experience. The adrenaline pumps like in no other film and rarely have we had the chance to see a heroine as compelling as Sigourney Weaver. She can kick anyone's ass and still keep a heart and soul. (Why she didn't win the Oscar back in 1986 is beyond me.) When the action starts, you're in for the ride of your life. Truly a milestone in movie making."
1,"I believe this movie to be one of the most excellent movies of our times. It has several aspects that make it especially great. Firstly, the music, the most important feature of this movie, in my opinion. Chopin nocturnes and polonaises are perfectly chosen and arrayed to create an unforgettable atmosphere. In one scene, they even take time to play the whole piece of music, without interfering. Secondly, the actors in the movie: none of them are/were really well known, but WOW! (for lack of a better word). Thirdly, it's one of the few movies, where you can actually watch the credits (forever) and wish the movie wouldn't end."
1,"This movie is not your ordinary Hollywood flick. It has a great and deep message. This movie has a foundation and just kept on being built on from their and that foundation is hope.

Other than just the message of this movie the acting was phenomenal. Tim Robbins gave one of the greatest performances ever. He was inspiring, intelligent and most of all positive. His performance just made me smile. Robbins plays Andy Dufresne who was wrongfully convicted of murdering his wife and her lover. He is gets to life sentences but yet never gives up hope. In he becomes friends with Ellis Boyd ""Red"" Redding played by Morgan Freeman. Freeman who gives the finest performance of his career has unlike Robbins lost hope."
1,"Engrossing motion picture that features some of the finest editing, cinematography and performances ever. There is a wonderful theme of family that runs through this film and its later sequels. No one is truly judged. Love is unconditional. God is the one who truly judges. Easily, the word masterpiece describes this film, but that's been said by so many...Who am I to argue? Masterpiece is right on the money."
1,"I haven't seen a movie like ""Before we go"" for a very long time. The script, the story the characters everything is just so charming and cute. I love that kind of ""intimacy"" on screen,it's intelligent and honest. I'm with a smile on my face after the movie. I think this is definitely not a commercial movie so if you need to see something different but at the same time very close to you. That will be not a waste of your time but a reason to questioning yourself and consume things in a different way"
1,"I can't say enough about how good this movie, that you probably haven't read, so I'm going to keep this short.

This is the best thing out there in theater's right now, and might just be the best animated film of all time, whether you believe that or not, is your own opinion, but what Pixar has done here, can put companies like Dreamworks, Sony, and Blue sky to shame.

Wall E also may go down as the most lovable character ever to grace the movie screen, I praise Ben Burtt and Andrew Stanton, and the people at Pixar for what they did, and will continue to do.

This is why Pixar is the top studio in the world."
1,"This film is beautifully animated, of course, to that magical Pixar point where even piles of what should be disgusting trash somehow look breathtakingly gorgeous and even fairly realistic-looking roaches look cute. But much more importantly, the heart, the emotion in this movie is unlike anything I've experienced at the cinema since Forrest Gump. Certainly my tear ducts have not welled up while watching a movie this much since then. I fell in like with the character of Wall-E when I saw the trailer. Watching the movie, I fell in love with him within about 2 minutes. Shortly after that, I fell in love with the idea of Wall-E falling in love."
1,"I've been a fan of DiCaprio long before he became famous and this here is without question the greatest performance he's given so far. I was curious to see how he would do playing someone crazy and wild like this but he does so perfectly and I'd say it was a flawless performance. No matter what was going on in this crazy life you believe that you're watching a real character and as his character says throughout the film, sell him something. Well, DiCaprio sells this performance and role like no one else could. The supporting players are just as wonderful with Jonah Hill, Margot Robbie, Rob Reiner, Jon Favreau, Matthew McConaughey and Jean Dujardin all delivering terrific performances. The cinematography, the music selections and everything else are just flawless here. THE WOLF OF WALL STREET could have been a complete disaster in so many ways but the strong screenplay and Scorsese's wicked direction makes it an incredibly entertaining film that works so well. It's hard to fully put into words what Scorsese and DiCaprio have pulled off but it's certainly one of the best and most memorable comedies in ages."
1,"Honestly, I came into this movie with so-so expectations as the trailer I saw in a different movie made me give myself a 50% chance to watch it, up in the air if you will. But from the moment the movie began up until the end, I was gripping for the characters the whole way, the way movies should be.

The opening of the movie played a huge part in setting the tone of the rest of the film. As I had no history or prior knowledge to the events that transpired in Iran in the 1980s, the brief amount of a history lesson was just enough to maintain my interest. Throughout the film, there are times when I might have started to wander through long bouts of dialog, but witty comments by the characters kept me entertained. By the time the climax was about to hit, I was sitting on the edge of my seat, biting at my fingers, awaiting their next move"
1,"The film is absolutely amazing and definitely one of the best films I've seen in a long time, throughout 2012 and 2013 so far we have been treated with some great films such as Skyfall, Django Unchained, Life of Pi, Les Miserables, Zero Dark Thirty and more, but in my own personal opinion Argo takes the bait as the best of them all. Proof is present as it won 3 BAFTA's for best picture, best director and best editing, also nominated for a further 8 Oscars in 85th Academy Awards."
1,"SARKAR is a creation of a life time from Ramu, it will remain as a highlight in all the artists careers, a great movie...it sucks you into it and throws you out. I watched the movie and before i could realise it started...it finished. When someone says slow narration...they are just ignorant of what cinema making is all about. Amitabh is excellent...on par with him is his son playing hi son in the movie, Abhishek. He is the one actor out of the young genre who will stand tall for a long time. The music of the movie is first rate, it plays a very important role in keeping us glued to what happens on screen.

I read a post saying ""a bad adaptation of godfather"" lets get this one clear that this is not Godfather. We get that impression because Ramu says he is inspired by the Hollywood movie, very kind of him. I have seen the movie and can confirm that approx 5% meets with what we have seen in Godfather. 

Talking about direction, i could write a couple of pages about it, but i prefer to say it is exceptional. Its a pity our movies do not get as much exposure as international cinema, but having watched movies from all other languages, Indian cinema coming from unorthodox directors like Ramu are far better."
1,"The film is wonderfully directed by Robert Zemeckis, the film is his opus and is acted by a great cast on all levels. From the children who were Forrest Gump and Gump Jr. by Haley Joel Osment. Say what you want but I feel Tom Hanks deserved the Oscar award. Gary Sinise is synonymous with Lt.Dan whenever you hear those words. Sally Fields is the loving dutiful mother in her challenging situation. Mykelti Williamson as Bubba gives you a real sense in the story that Gump had a genuine friend, he moves you with his character. Words don't grasp the full performance of Robin Wright Penn as Jenny. Jennys' tenderness and pain are palpable as exhibited by Wright"
1,When I first saw this movie I didn't appreciate it like I do now. I think it may have been because I was so young when I first saw it. Just recently I saw the movie again. What an amazing story and moving meaning. That movie teaches you so much about life and the meaning of it. That life isn't as bad as most people make it seem. That an innocent man can impact so many lives with his innocence. The meaning of the movie to me is that everyone needs to have a better outlook on life. That we need to appreciate more of the little things and not let the big things hold us back. That truly although life may throw us trials and tribulations like a box of chocolates but that we have to just bite into it and get through it even if we don't like it. That we all need to hold true to our values and not sink into a place that feels like there's no hope... I just love this movie. And anyone who hasn't seen it or who thinks that don't like it I seriously suggest seeing it or seeing it again. It truly is amazing
1,"i love this film, it is the ultimate thriller film, everything about se7en is brilliant. the cast are well picked and make the best contributions, the main characters Somerset and Mills are portrayed perfectly through Freeman and Pitt. in my opinion this is both Pitt and Freeman's best film, they still have not outshines there fantastic performances. Paltrow as mills wife was a good choice though there are a few other actresses that could have played this part, though i think that what paltrow brought to the role was the fragile emotional side of the character, so i am pleased that she played this part so well. the director is my favourite of all time, Mr David Fincher! he is a fantastic director, not just for this film but for his other films like fight club. he gets fantastic results from his cast and crew and makes the perfect film. and as i'm a budding editor myself i have to mention the fantastic edit on the film, by the editor Richard Francis-Bruce, i do love the edit on seven as he cut at hit points and generally did well"
1,"The storytelling is much more professional that the first one - which maybe laboured to introduce so much information - or the second one - which has little let up from the tension of long battle scenes. In Return of the King, there is an emotional sting at the start, as we watch the transformation of Gollum from warm, fun-loving guy to murderous, mutated wretch. The movie then moves deftly between different segments of the story - the sadness of the lovely soft-focus Liv Tyler as fated Arwen whose travails and woman's love succeeds in having the Sword that was Broken mended, the comradeship of Sam and Frodo (Sean Astin & Elijah Wood) that is tested to the limits, the strong commanding presence of Gandalf (Ian McKellen) who keeps an eye on things whilst turning in an Oscar-worthy performance, the ingenious and very varied battle scenes, and the mythical cities of that rise out of the screen and provide key plot elements."
1,"The score is phenomenal. Fellowship of the Ring had some ethereal, rousing, haunting and charming themes, whereas Two Towers was somewhat darker and more complex. Return of the King merges these together and the result is a perfect mixture of charm, darkness, etherality and complexity. The story is compelling with themes of friendship, strength and loyalty, the screenplay is well-written and literate and while the film is very long the three hours or so fly by seamlessly. The characters are engaging, Aragorn is even more interesting here than he is in the previous films while Gollum continues to steal every scene he appears in."
1,"he Shawshank Redemption and To Kill a Mockingbird are the best movies I have ever seen. I do not judge it by it's technical merits - I don't really care about that. I have read that Citizen Kane or The Godfather or this or that movie is the best movie ever made. They may have the best technique or be the most influential motion pictures ever made, but not the best. The best movies are ones that touch the soul. It takes a movie like The Shawshank Redemption to touch the soul."
1,"I have never seen such an amazing film since I saw The Shawshank Redemption. Shawshank encompasses friendships, hardships, hopes, and dreams. And what is so great about the movie is that it moves you, it gives you hope. Even though the circumstances between the characters and the viewers are quite different, you don't feel that far removed from what the characters are going through."
1,"One of the finest films made in recent years. It's a poignant story about hope. Hope gets me. That's what makes a film like this more than a movie. It tells a lesson about life. Those are the films people talk about 50 or even 100 years from you. It's also a story for freedom. Freedom from isolation, from rule, from bigotry and hate. Freeman and Robbins are majestic in their performances. Each learns from the other. Their relationship is strong and you feel that from the first moment they make contact with one another. There is also a wonderful performance from legend James Whitmore as Brooks."
1,"I love this movie and all of the GF movies. I see something new every time I have seen it (countless, truly). The story of tragedy and (little) comedy that exists in this film is easily understood by people all over the world. This film has been called an American story however I have met others who have seen this movie in other languages and they seem to have the same love and appreciation for it that I do. I love the characters and all of the different personalities that they represent not just in families but in society itself. It seems like the entire cast is part of every other movie that I love as well. The sounds, music, color and light in the film are just as much a part of the film as the people. This could be attributed to the method in which it was filmed. At many parts of the film I can still find myself feeling the emotions conveyed in the film. I never tire of appreciating this film. I thank God that FFC is an American treasure. We are fortunate to have him."
1,This movie is way to be good to be labelled a sequel to The Godfather . Rather it is more of a companion piece to the original and the two perfectly compliment each other . IT is both a sequel and prequel showing the rise of the young vito and moral decline of Micheal . Both characters are brought to life with uncanny ability by Robert DeNiro and Al Pacino . To say that these two are good actors is like saying that a nuclear bomb makes a loud noise and in this movie they prove why they are at the top of their respective crafts .
1,"was lucky enough to see this film for free at a special screening in greater London as part of a market research by the film industry. even though it was free i would have paid good money to see that film. but I was presently surprised about how good the film was and everyone seemed to agree that the film was really good. I thought it made the card playing parts actually riveting even though i am not a card player myself. i thought the acting performances were all good especially that of Kevin Spacey's. In terms of the story. In many ways it reminded me of all the good things that was in the BBC TV show hustle. But in a much more real way. On the down side, you may see the ending coming and there is a romance part of the film that feels unnecessary. However it is a very slick film that gets away with it. I would say that it clearly the best film in this genre of film. I enjoyed it more than films such as Confidence and the Oceans 11 type films. I would highly recommend it to anybody when it eventually comes out in April!! I would have thought that they would cut down and re-edit it a bit on the basis that it was quite long. however it kept my attention for the whole film and that is not something that is also done during these sorts of films"
